timestamp	status	algorithm	run_dir	params_m	epochs	imgsz	batch	device	model_summary	val_acc	val_macro_p	val_macro_r	val_macro_f1	test_acc	test_macro_p	test_macro_r	test_macro_f1	description
2026-06-06T14:51:22	keep	yoloctm	E:\Cjn\PCB_Yolo\runs\classify\autoresearch_yoloctm_nodistill_stepcond_class_attention_readout_tau04_e10_20260606_135126	10.527	10	224	64	0	yolo26m-cls.pt | ctm(d=96,s=6,drop=0.1,pow=0.5) | fusion=residual	0.9823851372186247	0.9160577878061835	0.90802559584836	0.9115232889273587					Deep non-distilled candidate: keep the best step-conditioned residual CTM dynamics and replace shared CTM pooling with class-specific attention readout, so each wafer-defect class can query the recurrent token state for its own spatial evidence; validation-only screening.
2026-06-06T15:50:23	discard	yoloctm	E:\Cjn\PCB_Yolo\runs\classify\autoresearch_yoloctm_nodistill_stepcond_class_attention_polar_readout_tau04_e10_20260606_145730	10.527	10	224	64	0	yolo26m-cls.pt | ctm(d=96,s=6,drop=0.1,pow=0.5) | fusion=residual	0.9772972556275054	0.8751423247170097	0.9131363340196508	0.8919794458305161					Deep non-distilled candidate: keep the best step-conditioned residual CTM dynamics and use class-specific CTM readout with a zero-initialized polar coordinate bias, targeting Loc/Edge-Loc spatial localization without step-logit losses or test access; validation-only screening.
2026-06-06T17:00:46	discard	yoloctm	E:\Cjn\PCB_Yolo\runs\classify\autoresearch_yoloctm_nodistill_stepcond_class_attention_entropy_readout_tau04_e10_20260606_160948	10.527	10	224	64	0	yolo26m-cls.pt | ctm(d=96,s=6,drop=0.1,pow=0.5) | fusion=residual	0.9823851372186247	0.9160577878061835	0.90802559584836	0.9115232889273587					Deep non-distilled candidate: keep the best step-conditioned residual CTM with class-specific attention readout and add only a small training-time normalized entropy penalty on readout weights, encouraging sharper class token evidence without distillation, coordinate priors, step-logit losses, test access, or inference-time parameter changes; validation-only screening.
2026-06-06T19:58:10	discard	yoloctm	E:\Cjn\PCB_Yolo\runs\classify\autoresearch_yoloctm_nodistill_stepcond_class_attention_blend_readout_tau04_e10_20260606_190418	10.527	10	224	64	0	yolo26m-cls.pt | ctm(d=96,s=6,drop=0.1,pow=0.5) | fusion=residual	0.9819226025285229	0.9126424304026189	0.9016553352370784	0.90673330712469					Deep non-distilled candidate: keep the best step-conditioned residual CTM dynamics and add a per-class learnable blend between class-specific attention readout and mean CTM pooling, testing whether classes hurt by pure class attention can fall back to stable mean evidence without distillation, step-logit losses, coordinate priors, or test access; validation-only screening.
2026-06-06T23:11:03	discard	yoloctm	E:\Cjn\PCB_Yolo\runs\classify\autoresearch_yoloctm_nodistill_stepcond_class_attention_halt95_tau04_e10_20260606_220920	10.527	10	224	64	0	yolo26m-cls.pt | ctm(d=96,s=6,drop=0.1,pow=0.5) | fusion=residual	0.9823851372186247	0.9160577878061835	0.90802559584836	0.9115232889273587					Deep non-distilled candidate: keep the best step-conditioned residual CTM with class-specific attention readout and change only the adaptive inference threshold from 0.90 to 0.95, making low-confidence validation samples take more CTM thought steps without distillation, step-logit losses, coordinate priors, or test access; validation-only screening.
2026-06-07T00:00:31	discard	yoloctm	E:\Cjn\PCB_Yolo\runs\classify\autoresearch_yoloctm_nodistill_stepcond_attention_readout_tau04_e10_20260605_220639	10.526	10	224	64	0	yolo26m-cls.pt | ctm(d=96,s=6,drop=0.1,pow=0.5) | fusion=residual	0.9793015726179464	0.8886779814788701	0.9059649876461502	0.8961988830752539					Deep non-distilled candidate: keep the best step-conditioned residual CTM dynamics and change only CTM readout from mean pooling to lightweight attention pooling, testing whether readout-side token selection improves minority wafer defects without constraining thought steps; validation-only screening.
2026-06-07T01:07:34	discard	yoloctm	E:\Cjn\PCB_Yolo\runs\classify\autoresearch_yoloctm_nodistill_stepcond_class_attention_min5_tau04_e10_20260607_000637	10.527	10	224	64	0	yolo26m-cls.pt | ctm(d=96,s=6,drop=0.1,pow=0.5) | fusion=residual	0.9823851372186247	0.9160577878061835	0.90802559584836	0.9115232889273587					Deep non-distilled candidate: keep the best step-conditioned residual CTM with class-specific attention readout and change only adaptive_min_steps from 4 to 5, forcing every validation sample to take one additional thought step before confidence-based halting; validation-only screening.
2026-06-07T02:02:07	crash	yoloctm	E:\Cjn\PCB_Yolo\runs\classify\autoresearch_yoloctm_nodistill_stepcond_class_attention_ldam_tau04_e10_20260607_020207		10	224	64	0	yolo26m-cls.pt | ctm(d=96,s=6,drop=0.1,pow=0.5) | fusion=residual									Pre-epoch config failure: training script rejected loss='ldam'; valid LDAM mode is loss='ldam_drw'. No checkpoint or validation/test metrics generated; relaunching corrected same candidate.
2026-06-07T02:56:18	discard	yoloctm	E:\Cjn\PCB_Yolo\runs\classify\autoresearch_yoloctm_nodistill_stepcond_class_attention_ldam_tau04_e10_20260607_020428	10.527	10	224	64	0	yolo26m-cls.pt | ctm(d=96,s=6,drop=0.1,pow=0.5) | fusion=residual	0.9820767807585569	0.9146793594453637	0.9080296008419706	0.9108497579599639					Deep non-distilled candidate: keep the best step-conditioned residual CTM with class-specific attention readout and change only the training loss from weighted CE to deferred LDAM-DRW margins, testing whether long-tail class-boundary pressure improves validation macro F1 without distillation, extra steps, or test access.
2026-06-07T03:52:58	keep	yoloctm	E:\Cjn\PCB_Yolo\runs\classify\autoresearch_yoloctm_nodistill_stepcond_class_attention_ldam_m01_tau04_e10_20260607_030102	10.527	10	224	64	0	yolo26m-cls.pt | ctm(d=96,s=6,drop=0.1,pow=0.5) | fusion=residual	0.9823465926611162	0.9163098317737715	0.9087818770958624	0.912020609416007					Deep non-distilled candidate: keep the class-attention step-conditioned CTM and LDAM-DRW schedule, but reduce ldam_max_margin from 0.2 to 0.1 to test whether milder long-tail class-boundary pressure can improve validation macro F1 without distillation or test access.
2026-06-07T04:54:06	discard	yoloctm	E:\Cjn\PCB_Yolo\runs\classify\autoresearch_yoloctm_nodistill_stepcond_class_attention_ldam_m005_tau04_e10_20260607_040342	10.527	10	224	64	0	yolo26m-cls.pt | ctm(d=96,s=6,drop=0.1,pow=0.5) | fusion=residual	0.9822309589885908	0.9163637359889231	0.9054178200495365	0.9103854226442668					Deep non-distilled candidate: keep the class-attention step-conditioned CTM and LDAM-DRW schedule, but reduce ldam_max_margin from 0.1 to 0.05 to test whether even milder long-tail class-boundary pressure improves validation macro F1 without distillation or test access.
2026-06-07T05:56:45	keep	yoloctm	E:\Cjn\PCB_Yolo\runs\classify\autoresearch_yoloctm_nodistill_stepcond_class_attention_ldam_m01_cbr005_tau04_e10_20260607_050437	10.527	10	224	64	0	yolo26m-cls.pt | ctm(d=96,s=6,drop=0.1,pow=0.5) | fusion=residual | cbr(w=0.005,p=1.0)@e7	0.9818069688559975	0.9107676750832172	0.9163022814941078	0.9131313775284673					Deep non-distilled candidate: keep the new class-attention LDAM-DRW margin-0.1 best and add a tiny deferred classifier-boundary regularizer (CBR weight 0.005 from epoch 7), testing classifier geometry pressure without distillation, architecture changes, or test access.
2026-06-07T06:56:45	keep	yoloctm	E:\Cjn\PCB_Yolo\runs\classify\autoresearch_yoloctm_nodistill_stepcond_class_attention_ldam_m01_cbr010_tau04_e10_20260607_060435	10.527	10	224	64	0	yolo26m-cls.pt | ctm(d=96,s=6,drop=0.1,pow=0.5) | fusion=residual | cbr(w=0.01,p=1.0)@e7	0.9822309589885908	0.9162220480322119	0.9115199989728234	0.9133844769616716					Deep non-distilled candidate: keep the class-attention LDAM-DRW + CBR 0.005 best and increase the deferred classifier-boundary regularizer to CBR weight 0.01 from epoch 7, testing whether slightly stronger classifier geometry pressure helps without distillation, architecture changes, or test access.
2026-06-07T07:55:32	discard	yoloctm	E:\Cjn\PCB_Yolo\runs\classify\autoresearch_yoloctm_nodistill_stepcond_class_attention_ldam_m01_cbr020_tau04_e10_20260607_070334	10.527	10	224	64	0	yolo26m-cls.pt | ctm(d=96,s=6,drop=0.1,pow=0.5) | fusion=residual | cbr(w=0.02,p=1.0)@e7	0.9821924144310823	0.9160347670661542	0.9106652981181226	0.9128871683813008					Deep non-distilled candidate: keep the class-attention LDAM-DRW + CBR 0.01 best and increase the deferred classifier-boundary regularizer to CBR weight 0.02 from epoch 7, testing the upper side of classifier geometry pressure without distillation, architecture changes, or test access.
2026-06-07T09:00:53	discard	yoloctm	E:\Cjn\PCB_Yolo\runs\classify\autoresearch_yoloctm_nodistill_stepcond_class_attention_ldam_m01_cbr010_expert_tau04_e10_20260607_080419	10.527	10	224	64	0	yolo26m-cls.pt | ctm(d=96,s=6,drop=0.1,pow=0.5) | fusion=residual | cbr(w=0.01,p=1.0)@e7 | experts=classwise_logprob(ctm_init=0.4)	0.980958988590811	0.9226379498902912	0.9003685113611019	0.9109162034388688					Deep non-distilled candidate: keep the class-attention LDAM-DRW + CBR 0.01 best and add class-wise log-prob expert fusion between the clean YOLO branch and the CTM branch, testing learned per-class perception/thought complementarity without distillation or test access.
2026-06-07T09:58:59	discard	yoloctm	E:\Cjn\PCB_Yolo\runs\classify\autoresearch_yoloctm_nodistill_stepcond_class_attention_ldam_m01_cbr010_logfusion_tau04_e10_20260607_090408	10.527	10	224	64	0	yolo26m-cls.pt | ctm(d=96,s=6,drop=0.1,pow=0.5) | fusion=residual | cbr(w=0.01,p=1.0)@e7	0.9762950971322849	0.8809786903677701	0.900720801123382	0.8899943351556002					Deep non-distilled candidate: keep the class-attention LDAM-DRW + CBR 0.01 best and add a single global log-prob fusion weight between the clean YOLO branch and the CTM branch, testing conservative perception/thought complementarity after classwise expert fusion failed.
2026-06-07T10:55:26	discard	yoloctm	E:\Cjn\PCB_Yolo\runs\classify\autoresearch_yoloctm_nodistill_stepcond_class_attention_ldam_m01_cbr010_polarenc_tau04_e10_20260607_100351	10.527	10	224	64	0	yolo26m-cls.pt | ctm(d=96,s=6,drop=0.1,pow=0.5) | fusion=residual | cbr(w=0.01,p=1.0)@e7 | spatial=polar(scale=0.05)	0.9798026518655566	0.8949669796697326	0.9085202266722692	0.9010680369633918					Deep non-distilled candidate: keep the class-attention LDAM-DRW + CBR 0.01 best and add polar spatial encoding to CTM tokens, testing wafer radial/angular positional priors without changing readout, distillation, data split, or test access.
2026-06-07T11:55:35	discard	yoloctm	E:\Cjn\PCB_Yolo\runs\classify\autoresearch_yoloctm_nodistill_stepcond_class_attention_ldam_m01_cbr010_noneaware075_tau04_e10_20260607_110426	10.527	10	224	64	0	yolo26m-cls.pt | ctm(d=96,s=6,drop=0.1,pow=0.5) | fusion=residual | cbr(w=0.01,p=1.0)@e7 | sampling=none_aware(none=0.75)@e1	0.977104532839963	0.8573997501597872	0.9446125172682565	0.8958599987513993					Deep non-distilled candidate: keep the class-attention LDAM-DRW + CBR 0.01 best and switch training sampling from natural to none-aware with none_sampling_ratio 0.75, testing whether reducing the dominant none class exposure improves validation macro F1 without architecture changes, distillation, or test access.
2026-06-07T13:20:01	discard	yoloctm	E:\Cjn\PCB_Yolo\runs\classify\autoresearch_yoloctm_nodistill_stepcond_class_attention_ldam_m01_cbr010_cwp06_tau04_e10_20260607_121941	10.527	10	224	64	0	yolo26m-cls.pt | ctm(d=96,s=6,drop=0.1,pow=0.6) | fusion=residual | cbr(w=0.01,p=1.0)@e7	0.9807277212457601	0.8984596163304587	0.9003582114361053	0.8982021938248087					Deep non-distilled candidate: keep the class-attention LDAM-DRW + CBR 0.01 best and increase class_weight_power from 0.5 to 0.6, testing a conservative objective-side imbalance adjustment without changing architecture, sampler, distillation, or test access.
2026-06-07T14:17:02	keep	yoloctm	E:\Cjn\PCB_Yolo\runs\classify\autoresearch_yoloctm_nodistill_stepcond_class_attention_ldam_m01_cbr010_cwp04_tau04_e10_20260607_132608	10.527	10	224	64	0	yolo26m-cls.pt | ctm(d=96,s=6,drop=0.1,pow=0.4) | fusion=residual | cbr(w=0.01,p=1.0)@e7	0.9822695035460993	0.9259497454857042	0.905713869046185	0.9154644535660744					Deep non-distilled candidate: keep the class-attention LDAM-DRW + CBR 0.01 best and decrease class_weight_power from 0.5 to 0.4, testing whether the current rare-class weighting is too aggressive without changing architecture, sampler, distillation, or test access.
2026-06-07T15:11:21	discard	yoloctm	E:\Cjn\PCB_Yolo\runs\classify\autoresearch_yoloctm_nodistill_stepcond_class_attention_ldam_m01_cbr010_cwp03_tau04_e10_20260607_142019	10.527	10	224	64	0	yolo26m-cls.pt | ctm(d=96,s=6,drop=0.1,pow=0.3) | fusion=residual | cbr(w=0.01,p=1.0)@e7	0.9798026518655566	0.9077160399603795	0.8931882063905634	0.8991775561862758					Deep non-distilled candidate: keep the class-attention LDAM-DRW + CBR 0.01 + class_weight_power 0.4 best and decrease class_weight_power further to 0.3, testing whether weaker inverse-frequency weighting continues to improve validation macro F1 without changing architecture, sampler, distillation, or test access.
